{
  "schema_id": "https://wrkr.dev/schemas/v1/proposed-action-contract-artifact.schema.json",
  "schema_version": "1",
  "artifact_id": "paca-f0439d8fbe107324",
  "contract_id": "pac-42354ce47489338a",
  "contract_family_id": "pacf-d7654d6666f3a346",
  "revision": 1,
  "producer": {
    "name": "wrkr",
    "artifact_schema_version": "1",
    "contract_schema_version": "3"
  },
  "source_scan_refs": [
    "saved_scan:v1"
  ],
  "composition_refs": [
    "cap-04370928364635c9"
  ],
  "resolution_key": "rk-843baf1b21135736+rk-95c14e9fdd46075b",
  "creation_evidence": [
    "wch-2514b320edea",
    "wch-e09776c197c7"
  ],
  "canonical_content_digest": "sha256:f0439d8fbe107324a125092aa4c4bf4e1b18d4d2c228e355edc1fe73d24e4c20",
  "variant": {
    "share_profile": "internal",
    "redacted": false
  },
  "report_only": true,
  "contract": {
    "contract_id": "pac-42354ce47489338a",
    "contract_family_id": "pacf-d7654d6666f3a346",
    "contract_content_digest": "sha256:650cd3de48f8559c5ae30f0b3cda2a266ea1e2653acdfbad2c5a5776f49073bc",
    "contract_version": "3",
    "contract_kind": "proposed_action_contract",
    "composition_ref": "cap-04370928364635c9",
    "resolution_key": "rk-843baf1b21135736+rk-95c14e9fdd46075b",
    "prohibited_transitions": [
      {
        "transition_id": "cat-154641492eda6828",
        "from_stage_id": "cas-9b871b9cb6fbbe5b",
        "to_stage_id": "cas-ab465825ec2b08e4",
        "from_role": "source",
        "to_role": "privileged_sink",
        "reason": "composition_transition"
      }
    ],
    "target_constraints": [
      {
        "key": "composition_id",
        "value": "cap-04370928364635c9"
      },
      {
        "key": "environment",
        "value": "production"
      },
      {
        "key": "outcome_class",
        "value": "production_deploy"
      },
      {
        "key": "target_class",
        "value": "production_impacting"
      },
      {
        "key": "target_identity",
        "value": "built_in:deploy_workflow+built_in:release_automation"
      }
    ],
    "required_credential_mode": "ephemeral",
    "maximum_delegation_depth": 4,
    "evidence_requirements": [
      "action_outcome",
      "approval",
      "credential_attenuation",
      "delegation_relationship",
      "jit_credential",
      "policy_decision",
      "proof_verification",
      "runtime_token_propagation"
    ],
    "acceptable_countersigners": [
      "control_owner",
      "security_reviewer"
    ],
    "expected_outcome_class": "production_deploy",
    "compensation_required": true,
    "source_digests": [
      "sha256:c05e5678452349abb58f97eac5c8550411fcacc2a5265f0739620e54878ef3ac"
    ],
    "report_only": true,
    "readiness_state": "blocked_by_contradiction",
    "reason_codes": [
      "authority:unresolved:affected_system_owner",
      "authority:unresolved:business_owner",
      "authority:unresolved:credential_subject_constraint",
      "authority:unresolved:delegation_root",
      "authority:unresolved:originating_intent",
      "authority:unresolved:permitted_agent_role",
      "authority:unresolved:policy_authority",
      "authority:unresolved:requester_identity",
      "authority:unresolved:separation_of_duties",
      "compensation:unresolved",
      "composition:delegation_broadened",
      "composition:evidence_incomplete",
      "delegation:excessive_child_authority",
      "expiry:deterministic_source_absent",
      "precondition:unresolved:credential_mode",
      "precondition:unresolved:effect_contract",
      "precondition:unresolved:environment",
      "precondition:unresolved:expected_effect",
      "precondition:unresolved:forbidden_effect",
      "precondition:unresolved:freshness",
      "precondition:unresolved:policy_digest",
      "precondition:unresolved:producer",
      "precondition:unresolved:required_check",
      "precondition:unresolved:sandbox",
      "precondition:unresolved:target",
      "precondition:unresolved:validation_contract",
      "readiness:needs_delegation_attenuation_evidence",
      "readiness:needs_proof_evidence",
      "recommended_control:block_standing_credential",
      "recommended_control:security_review",
      "report_only:true"
    ],
    "revision": 1,
    "authority_requirements": [
      {
        "requirement_id": "pacr-2f36b02f74422b27",
        "kind": "credential_subject_constraint",
        "required_constraint": "subject:built_in:deploy_workflow+built_in:release_automation",
        "observed_value": "built_in:deploy_workflow+built_in:release_automation",
        "evidence_state": "unknown",
        "freshness_state": "unknown",
        "evidence_refs": [
          ".gait/policy.yaml",
          "approval_status=unapproved",
          "baseline:discovered_surface",
          "credential_likely_scope:source_control_write",
          "credential_present:true",
          "credential_referenced_by_workflow:true",
          "credential_target_system:source_control",
          "matched_target:built_in:deploy_workflow",
          "matched_target:built_in:release_automation",
          "permission:deploy.write",
          "permission:deployments.write",
          "permission:filesystem.write",
          "permission:proc.exec",
          "permission:release.write",
          "permission:repo.write",
          "repo_fallback:repo_name",
          "repo_workflow_secret_correlation",
          "scope:source_control_write",
          "subject:cloud_admin_key",
          "target_system:source_control",
          "wch-2514b320edea",
          "wch-e09776c197c7",
          "workflow_secret_refs",
          "write_path:deploy",
          "write_path:write_capable",
          "write_path_class:deploy_write",
          "write_path_class:production_adjacent_write",
          "write_path_class:release_write",
          "write_path_class:repo_write",
          "write_path_class:write"
        ],
        "reason_codes": [
          "authority:credential_subject_constraint:unknown"
        ]
      },
      {
        "requirement_id": "pacr-71faa6274b936e1b",
        "kind": "permitted_agent_role",
        "required_constraint": "roles:privileged_sink,source",
        "observed_value": "privileged_sink,source",
        "evidence_state": "unknown",
        "freshness_state": "unknown",
        "evidence_refs": [
          ".gait/policy.yaml",
          "approval_status=unapproved",
          "baseline:discovered_surface",
          "credential_likely_scope:source_control_write",
          "credential_present:true",
          "credential_referenced_by_workflow:true",
          "credential_target_system:source_control",
          "matched_target:built_in:deploy_workflow",
          "matched_target:built_in:release_automation",
          "permission:deploy.write",
          "permission:deployments.write",
          "permission:filesystem.write",
          "permission:proc.exec",
          "permission:release.write",
          "permission:repo.write",
          "repo_fallback:repo_name",
          "repo_workflow_secret_correlation",
          "scope:source_control_write",
          "subject:cloud_admin_key",
          "target_system:source_control",
          "wch-2514b320edea",
          "wch-e09776c197c7",
          "workflow_secret_refs",
          "write_path:deploy",
          "write_path:write_capable",
          "write_path_class:deploy_write",
          "write_path_class:production_adjacent_write",
          "write_path_class:release_write",
          "write_path_class:repo_write",
          "write_path_class:write"
        ],
        "reason_codes": [
          "authority:permitted_agent_role:unknown"
        ]
      },
      {
        "requirement_id": "pacr-72ffe78854c97e4e",
        "kind": "requester_identity",
        "required_constraint": "requester_identity:required",
        "observed_value": "stage:cas-9b871b9cb6fbbe5b",
        "evidence_state": "unknown",
        "freshness_state": "unknown",
        "evidence_refs": [
          ".gait/policy.yaml",
          "approval_status=unapproved",
          "baseline:discovered_surface",
          "credential_likely_scope:source_control_write",
          "credential_present:true",
          "credential_referenced_by_workflow:true",
          "credential_target_system:source_control",
          "matched_target:built_in:deploy_workflow",
          "matched_target:built_in:release_automation",
          "permission:deploy.write",
          "permission:deployments.write",
          "permission:filesystem.write",
          "permission:proc.exec",
          "permission:release.write",
          "permission:repo.write",
          "repo_fallback:repo_name",
          "repo_workflow_secret_correlation",
          "scope:source_control_write",
          "subject:cloud_admin_key",
          "target_system:source_control",
          "wch-2514b320edea",
          "wch-e09776c197c7",
          "workflow_secret_refs",
          "write_path:deploy",
          "write_path:write_capable",
          "write_path_class:deploy_write",
          "write_path_class:production_adjacent_write",
          "write_path_class:release_write",
          "write_path_class:repo_write",
          "write_path_class:write"
        ],
        "reason_codes": [
          "authority:requester_identity:unknown"
        ]
      },
      {
        "requirement_id": "pacr-9301c432e05c77fd",
        "kind": "policy_authority",
        "required_constraint": "policy_authority:required",
        "evidence_state": "unknown",
        "freshness_state": "unknown",
        "evidence_refs": [
          ".gait/policy.yaml",
          "approval_status=unapproved",
          "baseline:discovered_surface",
          "credential_likely_scope:source_control_write",
          "credential_present:true",
          "credential_referenced_by_workflow:true",
          "credential_target_system:source_control",
          "matched_target:built_in:deploy_workflow",
          "matched_target:built_in:release_automation",